Other complications of skin graft (allograft) (autograft),2
"Staphylococcal arthritis, right knee",2
Other constipation,2
"Encntr for surgical aftcr fol surgery on the skin, subcu",2
"Fx unsp carpal bone, left wrist, subs for fx w routn heal",2
"Infect/inflm reaction due to int fix of site, init",2
Other neurologic disorders in Lyme disease,2
Acute systolic (congestive) heart failure,2
Other pancytopenia,2
Trigeminal neuralgia,2
Chronic pulmonary embolism,2
"Infection following a procedure, other surgical site, subs",2
Other sequelae of nontraumatic intracerebral hemorrhage,2
Cellulitis of abdominal wall,2
Other specified diseases of anus and rectum,2
Influenza due to oth ident influenza virus w oth manifest,2
Other specified polyneuropathies,2
Chronic venous hypertension w ulcer of bilateral low extrm,2
Other specified soft tissue disorders,2
"Unsp disp fx of 7th cervcal vert, subs for fx w routn heal",2
"Other spondylosis with radiculopathy, lumbar region",2
"Instability of internal right knee prosthesis, subs encntr",2
Other symp and signs w cogn fnctns fol ntrm intcrbl hemor,2
Copper deficiency,2
Other viral pneumonia,2
"Unsp fracture of right wrs/hnd, subs for fx w routn heal",2
"Paraplegia, unspecified",2
"Unsp fracture of sternum, subs for fx w routn heal",2
"Age-rel osteopor w crnt path fx, r forearm, 7thD",2
"Unsp fx head of right femur, subs for clos fx w routn heal",2
"Pathological fracture, oth site, subs for fx w routn heal",2
"Unsp fx lower end of l tibia, subs for clos fx w routn heal",2
"Pathological fracture, right femur, subs for fx w routn heal",2
"Ant displ Type II dens fracture, subs for fx w routn heal",2
"Acute pericarditis, unspecified",2
Cerebral atherosclerosis,2
"Periprosth fracture around internal prosth l hip jt, subs",2
"Displ commnt fx shaft of humer, r arm, 7thD",2
Peritoneal abscess,2
Chronic systolic (congestive) heart failure,2
Pneumonia due to Mycoplasma pneumoniae,2
"Lumbago with sciatica, right side",2
Pneumonia due to Pseudomonas,2
Chr emblsm and thombos unsp deep veins of r dist low extrm,2
"Gangrene, not elsewhere classified",2
Unspecified atrial flutter,2
"Age-rel osteopor w crnt path fx, r low leg, 7thD",2
Acute embolism and thombos unsp deep veins of r low extrem,2
Gastroparesis,2
"Unspecified dementia, unspecified severity, with agitation",2
Polymyalgia rheumatica,2
Unspecified protein-calorie malnutrition,2
"Diffuse large B-cell lymphoma, unspecified site",2
Unspecified viral hepatitis C without hepatic coma,2
Postherpetic trigeminal neuralgia,2
Varicos vn of r low extrem w ulc oth prt low extrm & inflam,2
"Bipolar disorder, unspecified",2
"Malignant neoplasm of brain, unspecified",2
"Collapsed vert, NEC, lumbar region, subs for fx w delay heal",2
"Pressure ulcer of left buttock, unstageable",2
Occlusion and stenosis of bilateral vertebral arteries,2
"Wedge comprsn fx second lum vert, subs for fx w routn heal",2
Aneurysm of other specified arteries,1
"Discitis, unspecified, thoracic region",1
"Unspecified dislocation of right shoulder joint, subs encntr",1
"Local-rel symptc epi w cmplx prt seiz,not ntrct,w/o stat epi",1
"Acute myeloblastic leukemia, not having achieved remission",1
Crohn's disease of small intestine w intestinal obstruction,1
Chronic pain due to trauma,1
Low back pain,1
"Hypersomnia, unspecified",1
"Lumbago with sciatica, left side",1
Secondary and unsp malignant neoplasm of intra-abd nodes,1
Drug induced acute dystonia,1
"Strain of musc/tend the rotator cuff of left shoulder, subs",1
"Lyme disease, unspecified",1
Cellulitis of left upper limb,1
Drug induced acute pancreatitis without necrosis or infct,1
"Unsp intestnl obst, unsp as to partial versus complete obst",1
"Major depressive disorder, recurrent, moderate",1
Varicose veins of left lower extremity with ulcer of calf,1
Encounter for other specified surgical aftercare,1
"Broken internal left hip prosthesis, subsequent encounter",1
"Major depressive disorder, single episode, moderate",1
"I/I react d/t cystostomy catheter, subsequent encounter",1
"Crohn's disease, unspecified, with intestinal obstruction",1
Sick sinus syndrome,1
"Major depressv disord, single epsd, severe w psych features",1
"Infct fol a procedure, organ and space surgical site, subs",1
"Major depressv disorder, recurrent severe w/o psych features",1
"Thrombosis due to vascular prosth dev/grft, subs",1
"Malig neoplm of conn and soft tiss of left low limb, inc hip",1
Candidal stomatitis,1
Malignant carcinoid tumor of the stomach,1
"Acute pancreatitis with uninfected necrosis, unspecified",1
"Malignant melanoma of right upper limb, including shoulder",1
"Disp fx of greater tuberosity of l humer, 7thD",1
Malignant neoplasm of anal canal,1
"Laceration with foreign body, left knee, subs encntr",1
"Malignant neoplasm of anus, unspecified",1
"Unspecified open wound, right thigh, initial encounter",1
Acc pnctr & lac of a GU sys org during a GU sys procedure,1
"Local infection of the skin and subcutaneous tissue, unsp",1
"Disp fx of prox phalanx of l idx fngr, 7thD",1
Alcohol-induced chronic pancreatitis,1
Malignant neoplasm of cecum,1
Pressure-induced deep tissue damage of left heel,1
"Enterocolitis due to Clostridium difficile, recurrent",1
Hypovolemia,1
Aphasia following other nontraumatic intracranial hemorrhage,1
Rheumatoid vasculitis w rheumatoid arthritis mult site,1
Enteropathogenic Escherichia coli infection,1
"Secondary parkinsonism, unspecified",1
Drug-induced polyneuropathy,1
Calculus of bile duct w/o cholangitis or cholecyst w/o obst,1
Malignant neoplasm of frontal lobe,1
"Complete traumatic amputation of left great toe, init encntr",1
Malignant neoplasm of gallbladder,1
STEMI involving oth coronary artery of inferior wall,1
"Epidural hemorrhage w/o loss of consciousness, subs encntr",1
Sunburn of third degree,1
Malignant neoplasm of left ovary,1
"Traum subdr hem w LOC of 30 minutes or less, subs",1
"Epilepsy, unsp, intractable, without status epilepticus",1
Type 1 diabetes mellitus with hyperglycemia,1
"Crushing injury of left foot, subsequent encounter",1
"Infect/inflm reaction due to oth internal joint prosth, init",1
Malignant neoplasm of parietal lobe,1
"Unsp dislocation of left acromioclavicular joint, subs",1
Malignant neoplasm of posterior mediastinum,1
"Unsp fracture of left wrs/hnd, subs for fx w routn heal",1
Achalasia of cardia,1
Acute interstitial pneumonitis,1
Malignant neoplasm of splenic flexure,1
"Disp fx of lateral end l clavicle, subs for fx w routn heal",1
"Malignant neoplasm of tonsil, unspecified",1
"Unsp open wound of right eyelid and periocular area, subs",1
Erosive (osteo)arthritis,1
"Laceration without foreign body of left forearm, subs encntr",1
"Displ oblique fx shaft of r tibia, 7thD",1
"Unspecified open wound, left knee, subsequent encounter",1
Acute kidney failure with tubular necrosis,1
Unspecified systolic (congestive) heart failure,1
Cutaneous abscess of chest wall,1
"Disp fx of olecran pro w/o intartic extn l ulna, 7thD",1
"Malignant neoplasm of uterus, part unspecified",1
"Pressure ulcer of left buttock, stage 1",1
Malignant neoplasm of vertebral column,1
Bladder-neck obstruction,1
"Malignant neoplasm of vulva, unspecified",1
Acute bronchitis due to other specified organisms,1
"Maxillary fracture, right side, 7thD",1
"Bronchopneumonia, unspecified organism",1
"Mech compl of coronary artery bypass graft, subs encntr",1
Primary lateral sclerosis,1
"Mech compl of gastrointestinal prosth dev/grft, subs",1
"Pulmonary hypertension, unspecified",1
"Mech compl of indwelling urethral catheter, subs",1
Raynaud's syndrome with gangrene,1
"Mech compl of int fix of bone of left lower leg, subs",1
"Chronic osteomyelit w draining sinus, right tibia and fibula",1
Esophageal obstruction,1
"I/I react d/t other urinary catheter, subsequent encounter",1
Esophageal varices with bleeding,1
Secondary malignant neoplasm of breast,1
"Mech compl of internal left knee prosthesis, subs encntr",1
Sepsis due to Methicillin resistant Staphylococcus aureus,1
Esophageal varices without bleeding,1
Slow transit constipation,1
"Esophagitis, unspecified without bleeding",1
"Spinal stenosis, thoracolumbar region",1
"Mech compl of other internal joint prosthesis, subs encntr",1
"Sprain of lateral collateral ligament of left knee, subs",1
"Mech compl of ventricular intracranial shunt, subs",1
"Squamous cell carcinoma skin/ left lower limb, including hip",1
"Mech loosening of internal right hip prosthetic joint, init",1
"Staphylococcal arthritis, left knee",1
"Mech loosening of internal right knee prosthetic joint, init",1
"Infect/inflm reaction due to cardiac valve prosthesis, subs",1
"Dvrtclos of intest, part unsp, w/o perf or abscess w bleed",1
"Strain of right quadriceps muscle, fascia and tendon, init",1
"Mechanical loosening of oth internal prosthetic joint, subs",1
"Syphilis, unspecified",1
"Displ simp suprcndl fx w/o intrcndl fx l humer, 7thD",1
"Infect/inflm reaction due to int fix of spine, init",1
Mesothelioma of other sites,1
"Displacement of implnt elec nstim of spinal cord lead, subs",1
"Arthritis due to other bacteria, right elbow",1
"Trochanteric bursitis, left hip",1
Chronic venous hypertension w/o comp of bilateral low extrm,1
Candidal cystitis and urethritis,1
"Extradural and subdural abscess, unspecified",1
"Carpal tunnel syndrome, bilateral upper limbs",1
Mild protein-calorie malnutrition,1
"Type III traum spondylolysis of 2nd cervcal vert, 7thD",1
Mixed irritable bowel syndrome,1
"Unsp athscl native arteries of extremities, left leg",1
Extrnod mrgnl zn B-cell lymph of mucosa-assoc lymphoid tiss,1
"Disp fx of base of nk of r femr, subs for clos fx w nonunion",1
Monoplg low lmb fol cerebral infrc aff right dominant side,1
"Unsp fracture of left calcaneus, subs for fx w routn heal",1
Monoplg upr lmb fol cerebral infrc aff left dominant side,1
"Disp fx of epiphy (separation) (upper) of r femr, 7thD",1
Monoplg upr lmb fol cerebral infrc aff left nondom side,1
"Unsp fx fourth thor vertebra, subs for fx w routn heal",1
Monoplg upr lmb fol cerebral infrc aff right dominant side,1
"Unsp fx lower end of r tibia, subs for clos fx w routn heal",1
Cutaneous abscess of face,1
"Disp fx of lateral condyle of r femr, 7thD",1
Facial weakness following cerebral infarction,1
"Disp fx of lateral end r clavicle, subs for fx w routn heal",1
"Age-rel osteopor w crnt path fx, l shldr, 7thD",1
"Unsp nondisp fx of surg nk of l humer, 7thD",1
"Arthropathy, unspecified",1
"Laceration with foreign body, left ankle, initial encounter",1
Cutaneous abscess of left axilla,1
"Laceration without foreign body of left buttock, subs encntr",1
Ataxia following nontraumatic subarachnoid hemorrhage,1
"Unspecified dementia, severe, with other behavioral disturb",1
Atherosclerosis of aorta,1
Unspecified mood [affective] disorder,1
Multi-system degeneration of the autonomic nervous system,1
"Unspecified open wound, right ankle, subsequent encounter",1
Multisystem inflammatory syndrome,1
"Disp fx of olecran pro w intartic extn r ulna, 7thD",1
Muscle spasm of back,1
Varicos vn of r low extrem w ulc of calf and inflammation,1
Fistula of intestine,1
"Vascular comp fol infusn, tranfs and theraputc inject, subs",1
Muscle weakness (generalized),1
Waldenstrom macroglobulinemia,1
Flaccid hemiplegia affecting right dominant side,1
"Local-rel symptc epi w cmplx partial seiz, ntrct, w stat epi",1
"Myalgia, other site",1
Abscess of vulva,1
"Myalgia, unspecified site",1
Dilated cardiomyopathy,1
"Flail chest, subs encntr for fracture with routine healing",1
"Pressure ulcer of left hip, unstageable",1
Flu due to oth ident flu virus w unsp type of pneumonia,1
"Ac emblsm and thombos unsp deep veins of dist low extrm, bi",1
"Myelodysplastic syndrome, unspecified",1
Acute bronchitis due to rhinovirus,1
Acute embolism and thrombosis of deep vein of r low extrem,1
"Bronchiectasis, uncomplicated",1
"Necrosis of amputation stump, left lower extremity",1
"Burn of second degree of buttock, subsequent encounter",1
Neoplasm of uncertain behavior of skin,1
Hypotension due to drugs,1
Dvrtclos of lg int w/o perforation or abscess w/o bleeding,1
"Primary osteoarthritis, left wrist",1
Cutaneous abscess of right axilla,1
Colostomy malfunction,1
"Neutropenia, unspecified",1
Pustulosis palmaris et plantaris,1
Flu due to unidentified influenza virus w oth resp manifest,1
"Burn of third degree of right lower leg, subs encntr",1
"Nondisp commnt fx shaft of humer, l arm, 7thD",1
Relapsing panniculitis [Weber-Christian],1
"Nondisp fx of 1st metatarsal bone, r ft, 7thD",1
Restless legs syndrome,1
"Nondisp fx of 5th metatarsal bone, l ft, 7thD",1
Acute pain due to trauma,1
"Nondisp fx of acromial pro, r shldr, 7thD",1
"Sacroiliitis, not elsewhere classified",1
"Nondisp fx of base of nk of r femr, 7thD",1
Idiopathic acute pancreatitis without necrosis or infection,1
"Fluid overload, unspecified",1
"Disp fx of 2nd metatarsal bone, l ft, 7thD",1
"Nondisp fx of greater trochanter of r femr, 7thD",1
Secondary malignant neoplasm of retroperiton and peritoneum,1
"Nondisp fx of greater tuberosity of l humer, 7thD",1
Sepsis due to Escherichia coli [E coli],1
"Follicular lymphoma grade III, unsp, lymph nodes mult site",1
"Sepsis following a procedure, initial encounter",1
"Nondisp fx of head of l rad, subs for clos fx w routn heal",1
Skin graft (allograft) rejection,1
"Nondisp fx of l radial styloid pro, 7thD",1
"Disp fx of 3rd metatarsal bone, l ft, 7thD",1
"Nondisp fx of lateral end l clavicle, 7thD",1
Inclusion body myositis [IBM],1
"Nondisp fx of med condyle of l tibia, 7thD",1
"Disp fx of ant column of l acetab, subs for fx w routn heal",1
"Nondisp fx of med cuneiform of l ft, 7thD",1
"Spondyls w/o myelopathy or radiculopathy, cervicothor region",1
"Nondisp fx of med malleolus of l tibia, 7thD",1
"Sprain of other specified parts of left knee, subs encntr",1
"Nondisp fx of navicular of l foot, subs for fx w routn heal",1
"Concussion without loss of consciousness, subs encntr",1
"Nondisp fx of neck of l rad, subs for clos fx w routn heal",1
"Stable burst fx first lum vertebra, subs for fx w routn heal",1
"Nondisp fx of neck of r rad, subs for clos fx w routn heal",1
"Stable burst fx third thor vert, subs for fx w routn heal",1
"Nondisp fx of olecran pro w/o intartic extn l ulna, 7thD",1
STEMI involving left main coronary artery,1
"Nondisp fx of r radial styloid pro, 7thD",1
"Stenosis due to nervous system prosth dev/grft, subs",1
"Follicular lymphoma, unspecified, intrathoracic lymph nodes",1
"Strain of musc/fasc/tend at thigh level, right thigh, subs",1
"Food in pharynx causing other injury, subsequent encounter",1
"Strain of muscle, fascia and tendon at neck level, subs",1
"Nondisp oblique fx shaft of l fibula, 7thD",1
"Strain of unsp musc/tend at lower leg level, left leg, subs",1
"Nondisp subtrochnt fx r femur, subs for clos fx w routn heal",1
Syncope and collapse,1
"Nondisp suprcndl fx w intrcndl extn low end r femr, 7thD",1
"Thoracic aortic aneurysm, without rupture, unspecified",1
"Foot drop, left foot",1
"Toxic effect of carb monx from mtr veh exhaust, acc, subs",1
"Nondisp Zone III fx sacrum, subs for fx w routn heal",1
"Traum hemor left cerebrum w/o loss of consciousness, subs",1
"Displ commnt fx shaft of l femr, 7thD",1
Calculus of kidney,1
Non-prs chr ulc unsp prt of r low leg limited to brkdwn skin,1
"Traumatic arthropathy, left knee",1
Fournier disease of vagina and vulva,1
"Traumatic pneumothorax, subsequent encounter",1
Non-prs chr ulcer of right heel and midft w fat layer expos,1
"Tubulo-interstitial nephritis, not spcf as acute or chronic",1
Non-prs chronic ulcer of right ankle w fat layer exposed,1
Type 1 diabetes mellitus with other specified complication,1
Non-prs chronic ulcer oth prt l foot limited to brkdwn skin,1
Type 2 diabetes mellitus with diabetic amyotrophy,1
Chronic venous htn w ulcer and inflam of bilateral low extrm,1
Carbuncle of left lower limb,1
Non-prs chronic ulcer oth prt left foot w fat layer exposed,1
"Carpal tunnel syndrome, right upper limb",1
Non-prs chronic ulcer oth prt left foot w necrosis of bone,1
Cellulitis of back [any part except buttock],1
Non-prs chronic ulcer oth prt left foot w necrosis of muscle,1
"Contusion of abdominal wall, subsequent encounter",1
Non-prs chronic ulcer oth prt r foot limited to brkdwn skin,1
"Unqualified visual loss, both eyes",1
"Fracture of coccyx, subs for fx w routn heal",1
Cellulitis of right finger,1
Cutaneous abscess of right lower limb,1
"Acute pancreatitis with infected necrosis, unspecified",1
Non-prs chronic ulcer skin/ other sites with oth severity,1
"Unsp disp fx of surg neck of r humer, subs for fx w nonunion",1
Chronic venous hypertension w/o comp of r low extrem,1
"Infrarenal abdominal aortic aneurysm, without rupture",1
Acute cholecystitis with chronic cholecystitis,1
"Contusion of lower back and pelvis, subsequent encounter",1
Nontraumatic chronic subdural hemorrhage,1
"Contusion of unspecified front wall of thorax, subs encntr",1
"Displ commnt fx shaft of r fibula, 7thD",1
"Intcran inj w/o loss of consciousness, subs encntr",1
Nontraumatic intracerebral hemorrhage in cerebellum,1
Adjustment disorder with other symptoms,1
Dvtrcli of lg int w/o perforation or abscess w bleeding,1
"Displ commnt fx shaft of humer, l arm, 7thD",1
"Fracture of orbital floor, left side, 7thD",1
"Intvrt disc disorders w radiculopathy, lumbosacral region",1
Obstruction of bile duct,1
"Unsp fx navicular bone of l wrist, subs for fx w routn heal",1
Obstruction of duodenum,1
Acute embolism and thrombosis of right femoral vein,1
"Fracture of orbital floor, right side, 7thD",1
Kidney transplant infection,1
"Fracture of oth parts of pelvis, subs for fx w routn heal",1
"Cervical disc disorder with myelopathy, unsp cervical region",1
Occlusion and stenosis of basilar artery,1
Dissection of unspecified site of aorta,1
"Fracture of superior rim of left pubis, init for clos fx",1
Chondrocostal junction syndrome [Tietze],1
Friedreich ataxia,1
"Unsp open wound of left great toe w damage to nail, subs",1
Dvtrcli of lg int w/o perforation or abscess w/o bleeding,1
"Unsp opn wnd r bk wl of thorax w/o penet thor cavity, subs",1
Occlusion and stenosis of left middle cerebral artery,1
"Unsp superficial injury of left lower leg, subs encntr",1
Occlusion and stenosis of right carotid artery,1
Unspecified age-related cataract,1
"Wedge comprsn fx T5-T6 vertebra, subs for fx w routn heal",1
Unspecified bacterial pneumonia,1
Cutaneous abscess of right upper limb,1
"Unspecified dementia, mild, without beh/psych/mood/anx",1
Cognitive social or emo def following cerebral infarction,1
"Disp fx of med wall of r acetab, subs for fx w routn heal",1
Wernicke's encephalopathy,1
"Unspecified injury of head, subsequent encounter",1
"Zygomatic fracture, right side, 7thD",1
"Unspecified open wound of right forearm, subs encntr",1
"Osteomyelitis of vertebra, sacral and sacrococcygeal region",1
Chronic embolism and thombos unsp deep veins of r low extrem,1
"Osteomyelitis of vertebra, thoracolumbar region",1
"Disp fx of neck of left rad, subs for clos fx w routn heal",1
"Osteonecrosis due to drugs, jaw",1
"Laceration without foreign body, left lower leg, init encntr",1
"Osteophyte, left shoulder",1
"Unspecified sprain of right shoulder joint, subs encntr",1
"Oth comp fol infusion, transfuse and theraputc inject, subs",1
Legionnaires' disease,1
Dvtrcli of sm int w perforation and abscess w/o bleeding,1
Varicose veins of bi low extrem w oth complications,1
"Oth complication of other internal prosth dev/grft, subs",1
Varicose veins of r low extrem with other complications,1
Acute on chronic combined systolic and diastolic hrt fail,1
Chronic lymphocytic leukemia of B-cell type in remission,1
"Cystitis, unspecified without hematuria",1
Vitamin B12 defic anemia due to intrinsic factor deficiency,1
Oth demyelinating diseases of central nervous system,1
Aftercare following explantation of hip joint prosthesis,1
"Oth disorders of plasma-protein metabolism, NEC",1
"Local-rel symptc epi w cmplx part seiz, ntrct, w/o stat epi",1
"Oth disp fx of second cervcal vert, subs for fx w routn heal",1
"Prepatellar bursitis, left knee",1
"Oth disp fx of upper end l humer, subs for fx w routn heal",1
"2-part nondisp fx of surg nk of l humer, 7thD",1
"Disp fx of shaft of right clavicle, subs for fx w routn heal",1
"Collapsed vert, NEC, thrclm region, subs for fx w routn heal",1
"Oth disrd of bone density and structure, left lower leg",1
"Diffuse TBI w/o loss of consciousness, subs",1
"Oth disrd of bone density and structure, left thigh",1
Alcoholic hepatic failure without coma,1
"Oth disrd of bone density and structure, other site",1
"Pressure ulcer of left hip, stage 3",1
"Oth disrd of bone density and structure, right ank/ft",1
Hypertensive emergency,1
"Oth enthesopathies of right lower limb, excluding foot",1
"Pressure ulcer of other site, stage 4",1
"Oth extrartic fx low end r rad, 7thD",1
"Breakdown (mechanical) of muscle and tendon graft, init",1
"Fx unsp part of neck of r femur, subs for clos fx w nonunion",1
Chronic venous htn w ulcer and inflammation of r low extrem,1
Dysphagia following nontraumatic intracerebral hemorrhage,1
"Pressure ulcer of right heel, stage 2",1
"Collapsed vert, NEC, cerv region, subs for fx w routn heal",1
"Collapsed vertebra, NEC, site unsp, subs for fx w routn heal",1
Chronic or unspecified duodenal ulcer with hemorrhage,1
"Pressure ulcer of right hip, stage 3",1
"Oth fracture of right femur, subs for clos fx w routn heal",1
"Burn of second degree of abdominal wall, subs encntr",1
"Displ suprcndl fx w intrcndl extn low end l femr, 7thK",1
"2-part disp fx of surg nk of r humer, 7thD",1
"Oth fracture of right talus, subs for fx w routn heal",1
Pressure-induced deep tissue damage of right buttock,1
"Oth fracture of shaft of r humerus, subs for fx w nonunion",1
"Burn of second degree of forehead and cheek, subs encntr",1
"Fx unsp part of scapula, l shldr, subs for fx w routn heal",1
"Primary osteoarthritis, left shoulder",1
"Oth fx lower end of r femur, subs for clos fx w routn heal",1
"Primary osteoarthritis, right ankle and foot",1
"Oth fx of lower end left rad, subs for clos fx w routn heal",1
Progressive multifocal leukoencephalopathy,1
"Oth fx of lower end r radius, subs for clos fx w routn heal",1
"Prph tear of medial meniscus, current injury, l knee, subs",1
Gangrene and necrosis of lung,1
"Pure hypercholesterolemia, unspecified",1
"Oth fx upper end of left ulna, subs for clos fx w routn heal",1
"Burn of third degree of abdominal wall, subsequent encounter",1
"Acute pharyngitis, unspecified",1
"Radiculopathy, cervical region",1
Acute embolism and thrombosis of right internal jugular vein,1
"Radiculopathy, lumbosacral region",1
"Oth generalized epilepsy, not intractable, w/o stat epi",1
"Dislocation of C4/C5 cervical vertebrae, subs encntr",1
"Oth inflammatory and immune myopathies, NEC",1
Renovascular hypertension,1
"Oth intartic fx low end l rad, subs for clos fx w routn heal",1
"Acute maxillary sinusitis, unspecified",1
Abscess of the breast and nipple,1
Calculus in bladder,1
"Oth nondisp fx of 3rd cervcal vert, subs for fx w routn heal",1
"Dislocation of other internal joint prosthesis, subs encntr",1
Gastrostomy malfunction,1
Rheumatoid myopathy w rheumatoid arthritis of multiple sites,1
Acute lymphadenitis of lower limb,1
Anal abscess,1
Athscl native art of left leg with ulcer oth prt low leg,1
Saddle embolus of pulmonary artery w/o acute cor pulmonale,1
"Oth paralytic syndrome following cerebral infrc, bilateral",1
Calculus of bile duct w acute cholangitis with obstruction,1
Oth parlyt syndrome fol cerebral infrc aff left nondom side,1
"Idiopathic gout, left ankle and foot",1
"Wedge comprsn fx fourth lum vert, subs for fx w routn heal",1
"Disp fx of 1st metatarsal bone, r ft, 7thD",1
"Disp fx of olecran pro w/o intartic extn r ulna, 7thD",1
"Idiopathic gout, right ankle and foot",1
Oth postproc complications and disorders of nervous sys,1
Secondary malignant neoplasm of mediastinum,1
Oth postprocedural complications and disorders of dgstv sys,1
"Secondary osteoarthritis, right wrist",1
Oth sequelae following nontraumatic subarachnoid hemorrhage,1
"Idiopathic gout, right knee",1
Oth symptoms and signs w cognitive functions and awareness,1
"Idiopathic gout, right wrist",1
Oth transient cerebral ischemic attacks and related synd,1
Sepsis due to other specified staphylococcus,1
"Other acute osteomyelitis, right ankle and foot",1
Calculus of bile duct w chronic cholecyst w/o obstruction,1
Other acute postprocedural pain,1
"Iliotibial band syndrome, right leg",1
Other Alzheimer's disease,1
Sleep related leg cramps,1
"Other cervical disc degeneration, cervicothoracic region",1
Immune thrombocytopenic purpura,1
"Other cervical disc degeneration, high cervical region",1
"Spinal stenosis, cervicothoracic region",1
"Other cervical disc degeneration, unsp cervical region",1
Calculus of bile duct with acute cholangitis w/o obstruction,1
Other cholangitis,1
"Spinal stenosis, thoracic region",1
"Other chondrocalcinosis, left knee",1
"Infct fol a proc, superfic incisional surgical site, init",1
"Other chondrocalcinosis, right knee",1
"Spondylolisthesis, lumbosacral region",1
Athscl native art of right leg with ulcer oth prt low leg,1
Acute rheumatic endocarditis,1
Other chronic pancreatitis,1
"Spontaneous rupture of other tendons, left thigh",1
Other chronic postprocedural pain,1
"Sprain of medial collateral ligament of right knee, subs",1
